Questions,Category
"In how many possible orders a student can answer 5 questions in the SEE exams considering the following conditions i) There are 3 units UNIT1, UNIT2 and UNIT3 consisting of 3, 3 and 2 questions respectively. ii) Student has to answer 2 questions from UNIT 1 , 2 questions from UNIT 2 and one from UINIT 3",BT2
"In order to conduct the SEE examination, In how many ways seating arrangement can be made for 240 CS students and 240 EC students such that CS and EC students should sit alternatively.",BT3
School of Computer Science and Engineering is planning to create a Computer network lab of 15 computers. In how many ways every computer is connected to every other computer for each of the following assumptions. i) Every computer is implicitly connected to itself ii) Every computer is explicitly connected to itself iii) Every connection is one-way communication iv) Every connection is two-way communication,BT3
"Let R be the relation on the set of people with doctorates such that (a, b) ? R if and only if ‘a’ was the thesis advisor of ‘b’. When is an ordered pair (a, b) in R2 ? When is an ordered pair (a, b) in Rn , when n is a positive integer? (Assume that every person with a doctorate has a thesis advisor.)",BT3
"Let R1 and R2 be the “congruent modulo 3” and the “congruent modulo 4” relations, respectively, on the set of integers. That is, R1 = {(a, b) | a ? b (mod 3)} and R2 = {(a, b) | a ? b (mod 4)}. Find i) R1 U R2. ii) R1 ? R2. iii) R1 ? R2. iv) R2 ? R1.",BT2
"A vending machine dispensing books of stamps accepts only onedollar coins, $1 bills, and $5 bills. a) Find a recurrence relation for the number of ways to deposit n dollars in the vending machine, where the order in which the coins and bills are deposited matters. b) What are the initial conditions? c) How many ways are there to deposit $10 for a book of stamps?",BT3
"Solve these recurrence relations together with the initial conditions given. i. an = 2an?1 for n ? 1, a0 = 3 ii. an = an?1 for n ? 1, a0 = 2",BT2
a) Find a recurrence relation for the number of steps needed to solve the Tower of Hanoi puzzle. b) Show how this recurrence relation can be solved using iteration.,BT3
"Check whether the binary operation * is commutative and associative on the seta) On Z, where a*b is ab b) on Z+, where a*b is a+b+2",BT3
"Prove or disprove the binary operation on Z+ of a*b = GCD(a,b) has the idempotent property",BT3
Check whether set Z with the binary operation of subtraction is a semi group.,BT2
Define – i) Group ii) Rings iii) Fields give one example for each with domain as set of positive integers.,BT2
"Suppose we wish to search a linked list of length n, where each element contains a key k long with a hash function h(k). Each key is a long character string. How might we take advantage of the hash values when searching the list for an element with a given key?",BT3
"With the help of suitable code snippets, Prove That: “Queue is NO more exactly a First In First Out data structure”",BT2
Using state space tree prove that: • There is no solution for a 2 queen problem • There are multiple solutions for a 4 queen problem,BT2
Differentiate between Structures and Unions with suitable code snippets,BT3
"A linear probing has a hash function of the form: h(k, i) = (h’(k) + i) mod m and a quadratic probing has a hash function of the form: h(k, i) = (h’(k) + c 1 i + c 2 i 2 ) mod m. Linear probing suffers from a problem known as primary clustering and quadratic probing from secondary clustering. Discuss",BT3
"Consider the circular list given below with string data: Write a function which will display the output in following fashion: i think i can think i can i can can At each line, the function should display data from all the nodes present. After printing each line, an appropriate node has to be deleted. After printing the last line, “last” pointer should be holding the NULL value.",BT3
Write a program to print the nth node from end from a singly linked list.,BT3
"Complete the function described below: Function Name: summon Input Params: base address of string Return Type: base address of summoned string Description: A magician wants to generate summoning charms. For input string “firebolt”, the function should produce “summon firebolt”. Do not use any inbuilt string handling functions.",BT3
Write the modules to implement the following using Stack data structure: • Check if the given string is palindrome • Sort the given set of integers,BT3
"You have been invited to a post-exam party. i) You walk in and shake everyone’s hand. As the number of attendees N increases, what is the order of growth to shake everyone’s hand? Justify. ii) You meet everyone else and during each meeting, you talk about everyone else in the room. To what efficiency class does this belong to? Justify.",BT4
"Create a AVL Tree for: 50, 60, 80, 30, 20, 40, 70 Can you perform the three tree traversals on AVL tree? Justify your answer.",BT3
State Ohm’s law,BT1
Explain the importance of sustainability in Engineering design,BT2
List the physical and chemical properties of silicon,BT1
List the components of A/D converter,BT1
List the arithmetic operators available in C in increasing order of precedence,BT1
Explain the behaviour of PN junction diode under different bias conditions,BT2
Define the purpose of a constructor,BT1
"Define the terms: Sensible heat, Latent heat and Total heat of evaporation",BT1
Describe the characteristics of SCR and transistor equivalent for a SCR,BT2
List the assembler directives,BT1
Describe the process of galvanisation and tinning,BT1
"Write truth table and symbol of AND, OR, NOT, XNOR gates",BT1
"Define the terms: Stress, Working stress and Factor of safety",BT1
What is the difference between declaration and definition of a variable/function,BT1
List the different storage class specifiers in C,BT1
"Explain the terms: Particle, Rigid body and Deformable body giving two examples for each.",BT2
What is the use of local variables,BT1
What is a pointer to a pointer,BT1
What are the valid places for the keyword “break” to appear,BT1
What is a self-referential structure,BT1
How many values of the variable num must be used to completely test all branches of the following code fragment? if (num>0) if (value,BT2
Discuss the effect of Make in India initiative on the Indian manufacturing Industry,BT2
Summarise the importance of ethical code of conduct for engineering professionals,BT2
Apply Bellman-Ford Algorithm on the given graph How is Bellman-Ford different from Dijkstra’s Algorithm?  to what design technique does the algorithm belong to? Explain.,BT3
Bring out the differences between Prim’s and Kruskal’s algorithm. Also compare with respect to efficiency analysis.,BT2
Write a algorithm for given below description: ALGORITHM CountLeafNodes(T) // Recursively counts the number of leaf nodes in the tree T,BT3
"Apply Quick Sort on the following: Q U I C K S O R T Write the efficiency analysis of quick sort (Best, Worst, and Average).",BT3
Write the algorithm design technique for the given below algorithms/problems: i) N-Queen’s Problem ii) Binary Search iii) Insertion Sort iv) AVL Trees v) Heap Sort vi) Hashing vii) Boyer-Moore viii) Breadth First Search,BT2
"A DNA sequence consists of a text on the alphabet {A, C, G, T} and the gene or gene segment is the pattern. For the pattern for chromosome-10: TCCTATTCTT construct the following tables: i) ?- table ii) Bad Symbol Shift Table",BT3
Write a function to delete a node from a Binary Search Tree. Suitably comment the code explaining each of the cases.,BT3
What are indexed sequential files?,BT1
Explain fseek( ) API with help of a C suitable program. Explain each of the parameter it takes in detail.,BT3
A file consists of binary data. Write a program to read and count the number of 0’s and 1’s in it. Write the individual count in a separate file. Also find the size of the file.,BT3
What do you mean by storage release?,BT1
Differentiate between the fixed block and variable block storage management.,BT2
With a help of a suitable program explain the concept of Bit Maps and how they can be used as an efficient storage means,BT3
"Implement the Boolean function F(A,B,C,D)=BC+ABC+A?C?D using only a single 8X1 Multiplexer where signals A,B,C,D and D? represent the inputs.",BT2
"The circuit diagram of a synchronous counter is shown in the given figure. Determine the sequence of states of the counter assuming that the initial state is “000?. Give your answer in a tabular form showing the present state QA, QB, QC, J-K inputs (JA, KA, JB, KB, JC, KC) and the next state QA+, QB+, QC+. From the table, determine the modulus of the counter.",BT3
"Consider the instruction Load R2,(R3). What control signals are generated in the datapath during the execution of this instruction. Justify your answer with proper reasoning.",BT3
"Realize a Boolean expression f(w,x,y,z)=?m(1,2,6,7,8,9,11,13,14,15) using Multiplexer Tree structure. The first level should consist of two 4: 1 MUX with variables w and z on their select lines S1 and S0 respectively and second level should consist of single 2:1 MUX with variable y on the select lines",BT2
i. Explain the working of Gated SR latch. ii. What is forbidden state? iii. Determine the output waveform for a gated SR latch,BT3
"i. Load R4,(R3) ii. Store R4,(R3) For the above instructions draw the timing diagrams for synchronous bus operation",BT3
Explain Hardwired Control unit.,BT2
"Design , Simulate and implement a 4-bit Universal Shift Register for following operation",BT3
"There is a queue for exchange of old 500 rupees currency notes after demonetization, in the post office. But a single customer can exchange only upto Rs. 4000/- per day. What components are necessary to design a system which alerts the user on reaching the maximum count? Also design the system to automate the counting process",BT3
Explain the operational model of SIMD computers.,BT2
"A 40 MHz processor was used to execute a benchmark program with the following instructions and clock cycle counts: Determine the effective CPI, MIPS rate and execution time for this program.",BT3
"Consider a main memory built with SDRAM chips. Data are transferred in burst lengths of 8. Assume that 32 bits of data are transferred in parallel. If a 400-MHz clock is used, how much time does it take to transfer: (a) 32 bytes of data (b) 64 bytes of data What is the latency in each case?",BT3
Explain the pipelining process in VLIW processors.,BT2
"The execution times (in seconds) of four programs on three computers are given below: Assume that 100,000,000 instructions were executed in each of the four programs. Calculate the MIPS rating of each program on each of the three machines. Based on these ratings, can you draw a clear conclusion regarding the relative performance of the three computers? Rank them statistically.",BT3
With neat figure show how a very small memory chip consisting of 16 words of 8 bits each is organized (16 X 8 organization). What is Double-Data-Rate SDRAM?,BT3
With a neat diagram of computer architecture explain the components involved in modern computer architecture.,BT2
"How does instruction set, compiler technology, CPU implementation and control and cache and memory hierarchy affect the CPU performance and justify the effects in terms of program length, clock rate and effective CPI",BT3
Design a 8M x 32 size memory chip using memory chips of i. 512K x 16 ii. 256K x 8 Draw the diagrams showing appropriate connections for each of the above cases.,BT3
"With a neat diagram explain 5-stage pipeline organization. Consider the following instructions at the given addresses in the memory: 1000 ADD R4, R3, R2 1004 OR R7, R6, R5 1008 SUBTRACT R8, R7, R4 Initially, registers R2 and R3 contain 4 and 8, respectively. Registers R5 and R6 contain 128 and 2 respectively. Assume that pipeline provides forwarding paths to the ALU from registers RY and RZ. The first instruction is fetched in clock cycle 1, and the remaining instructions are fetched in successive cycles. Draw a pipelined execution of these instructions assuming that processor is using operand forwarding. Describe the contents of registers, RY, and RZ in the pipeline during cycles 4 to 7.",BT3
"Explain with an example the different types of hazards. The following instructions are executed in pipelined architecture. SUBTRACT R4,R2,R3 BRANCH NEXT OR R1, R2,#5 MUL R3,R4,R2 NEXT: LOAD R5,[R0] ADD R6,R5,R2 Identify hazards and suggest hardware or software approach to minimize the hazards.",BT3
"Assume that 25% of dynamic count of instructions executed for a program is branch instructions. There are pipeline stalls due to data dependencies; static branch prediction is used with non-taken assumption. i.Determine execution time for two cases: when 30% of branches are taken, and when 80% of branches are taken. ii.Determine the speedup for one case relative to other. Express the speedup as percentage relative to 1.",BT3
Explain the role of Dispatch unit to resolve Deadlock in scalar processor.,BT2
"A dealer has a warehouse that stores a variety of fruits and vegetables. When fruit is brought to the warehouse, various types of fruit may be mixed together. The dealer wants a model that will sort the fruit according to type. Justify with reasons how machine learning model is efficient compared to feature based classification technique.",BT2
"Suppose you are only allowed to use binary logistic classifiers to solve a multi-class classification problem. Given a training set with 2 classes, this classifier can learn a model, which can then be used to classify a new test point to one of the 2 classes in the training set. You are now given a 6 class problem along with its training set, and have to use more than one binary logistic classifier to solve the problem, as mentioned before. Propose the following scheme - you will first train a binary logistic classifier for every pair of classes. Now, for a new test point, you will run it through each of these models, and the class which wins the maximum number of pairwise contests, is the predicted label for the test point. How many binary logistic classifiers will you need to solve the problem using your proposed scheme?",BT3
"Describe the two error functions that are used for neural networks. Suppose we are training a neural network for binary classification, justify the type of error function which is suitable to solve the problem.",BT3
Why it is necessary to estimate the accuracy of hypothesis. Explain procedure to estimate difference in error between two learning methods.,BT3
Explain the effect of following factors in achieving global minima with gradient descent algorithm.,BT3
What is a variable,BT1
"Calculate the cost value of linear regression for the following dataset. X=[1,2,3,4,5 ] Y=[3,6,7,11,15 ] Slope of hypothesis (?1) = 7 Constant/ intercept (?0)=5 Epoch=3 Learning rate (?) = 0.5",BT3
"Determine the Principal Components for the given 2-Dimensional dataset. (1, 2), (2, 4), (3, 6).",BT3
"Suppose that we want to build a neural network that classifies two dimensional data (i.e., X = [x1, x2]) into two classes: diamonds and crosses. We have a set of training data that is plotted as follows: Draw a network that can solve this classification problem. Justify your choice of the number of nodes and the architecture. Draw the decision boundary that your network can find on the diagram.",BT3
"Consider the following Neural Network with alpha = 0.5, eta=0.24, desired output = 1 and sigmoid activation function. i. Perform one forward pass and calculate the error. ii. Calculate the updated weights for w5 and w6 using backpropagation.",BT3
"Consider the following graphical model, which defines a joint probability distribution over five Boolean variables. Apply Expectation Maximization to train this Bayesian network, given training data in which the variables F, S, H and N are fully observed, and where the variable A is sometimes unobserved. a. What are the conditional probability distributions associated with each of the five random variables in this network? b. What variables are in the Markov blanket for variable A? c. Given that all variables in the Markov blanket of A are observed, it should be possible to compute the distribution over A based on only these variables. Simplify your expression from part",BT3
Ram is working on a project which requires returning multiple values from a function. He observed that a return statement can only be used to return a single value from a function. How the function should be implemented so that multiple values can be returned by Ram,BT4
Apply SVM algorithm for the data-points and find dimension of hyper plane to classify the data-points for the figure. (assume bias =1),BT3
What is linearly in separable problem? Design a two layer network of perceptron to implement XOR and AND gates.,BT2
Develop a Q learning task for recommendation system of an online shopping website. What will be the environment of the system? Write the cost function and value function for the system.,BT3
Explain how an agent can take action to move from one state to other state with the help of rewards.,BT3
What is a compiler? List names of any 2 compilers,BT1
Explain reinforcement learning in detail along with the various elements involved in forming the concept. Also define what is meant by partially observed state.,BT3
Explain how reinforcement learning problem differs from other function approximation.,BT2
"Classify and justify the following applications as Batch oriented or Interactive. Generating monthly bank statement, Word processing, Generating personal tax returns",BT2
Discus implementation of mutual exclusion with semaphores. Explain the role of wait( ) and signal( ) functions in this regard.,BT2
Consider the following processes with their arrival time and burst time as given below: Identify appropriate data structure to implement following scheduling algorithms for the above scenario. Which one among them gives optimized scheduling with respect to waiting time? a. FCFS b. Shortest remaining time first ( SJF preemptive) c. Round Robin (time quantum = 4 units) ,BT3
"Consider the concurrently running processes A and B as given below. (Shared data: semaphore s1=0, s2=0;) Process A: do { Instruction a; Signal (s1); instruction b; Wait (s2); Instruction e; } while (true); Process B: do { Wait (s1); Instruction d; Instruction c; Signal (s2); } while (true) Illustrate the order in which these instructions (A, B, C and D) will get executed?",BT3
What are the benefits of designing a flowchart for solving a problem,BT4
Differentiate between one-to-one and many-to-many model used for multithreading implementation,BT2
Assume two operations i) A(counter++) ii) B(counter--) Both are running following code: reg1= counter; reg1= Reg1+1; Counter = reg1; Check for occurrence of Race condition. Propose different approaches to solve race condition if it exists.,BT3
"Every Saturday ram will get up at morning 6 o clock. His wife Swapna wants him to help her out with doing the house since guests were expected to arrive that evening. This would take Ram 45 minutes. His daughter Priya wants him to help her out in solving a math problem for 15 min, before she could face a test that afternoon in the tuition classes. Ram’s son Arun, wants to be dropped at his friend’s place as he is going to movie at 4pm. This would take an hour of travel. Ram’s boss now calls him and asks him to call up a client and have a telecon on a particular business deal which would take him 20 minutes. In the evening 4 pm his colleague asks him a help to send one email to client so that in the night client will check and reply. It will take approximately 30 min. As age factor plays imp role Ram will be taking 5 min rest after each work.",BT3
"Suppose that a disk drive has 5000 cylinders, numbered 0 to 4999. The drive is currently serving a request at cylinder 143, and the previous request was at cylinder 125. The queue of pending requests, in FIFO order, is: 86, 1470, 913, 1774, 948, 1509, 1022, 1750, 130 Starting from the current head position, what is the total distance (in cylinders) that the disk arm moves to satisfy all the pending requests for each of the following disk scheduling algorithms? i)FCFS ii) SSTF iii) SCAN iv) LOOK",BT3
"t is desired to operate a 100 W, 120 V, electric bulb at its rated current on a 240 V, 50 Hz supply. The simplest arrangement is to use either (a) a resistor, or (b) a capacitor or (c) an inductor having 10 ? resistance in series with the electric bulb so as to drop the excess voltage. Determine the value of the component used, the total power consumed and the power factor in each case. Giving reasons, state which alternative is the best",BT4
Determine the total amount of internal fragmentation using i) First fit ii) Best fit iii) Worst fit techniques for the memory requests given below:,BT2
" Consider the following snapshot of a system: Answer the following questions using the Banker’s algorithm: a. Is the system in a safe state? b. If a request from process P4 arrives for (0, 3, 2, 0), can the request be granted immediately? ",BT3
"Determine the total number of page faults and page fault rate for the reference string given below using following page replacement algorithms. i) FIFO ii) Optimal iii) LRU (Assume Number of frames = 4) Reference string: 3, 2, 5, 0, 1, 3, 5, 0, 7, 8, 2, 1, 2, 3, 4, 5, 8, 4, 7, 8",BT3
"A wireless battery powered drilling machine operates on 24 V DC with constant speed and negligible field current. Initially when the machine is powered it runs at 1200 rpm and draws 0.5 A from the battery. Further when the drill bit starts drilling the hole, the speed reduces to 1120 rpm. Determine power requirement from the battery for drilling if the resistance of the armature is 0.2?. What is the power drawn initially?",BT4
With neat diagram describe the Paging hardware with translation lookaside buffer (TLB). Also calculate the effective memory access time for the following specification. Hit ratio = 60%.Memory access time = 200 nano seconds TLB search time = 50 nano seconds,BT3
Discuss the strengths and weaknesses of implementing an access matrix using access lists that are associated with objects.,BT2
Explain why a capability-based system such as Hydra provides greater flexibility than the ring-protection scheme in enforcing protection policies.,BT3
"To protect an expensive circuit component from being delivered too much power, you decide to incorporate a fast blowing fuse into the design. Knowing that the circuit component is connected to 12 V, its minimum power consumption is 12 watts and the maximum power it can safely dissipate is 100 watts, which of the three available fuse ratings should you select: 1A , 4A or 10 A? Give reasons",BT4
Explain overall architecture of Android Operating system. What are the benefits of using Android for Mobile application development,BT2
Discuss design issues of network operating systems. Comment on use of dedicated routers/gateways against general purpose computers for networking.,BT3
Answer the following questions with justification,BT3
"Consider the following database of travel sequences for one working week of a traveler: i) Use the Apriori algorithm to compute all frequent itemsets, and their support, with minimum support 3. Clearly indicate the steps of the algorithm, and the pruning that is performed. (ii) Which of the frequent sequences are maximal? (iii) Which of the frequent sequences are closed?",BT3
"(i) For the Traveler dataset given in Figure 3.a, answer the following questions: [A] Which kind of plots are suitable for each of the 'gender', 'signup_method', 'first_device_type', 'first_browser' and 'timestamp_first_active' attributes. [B] Which kind of plots are suitable for numerical data, give example. [C] Classify each of the following attributes {'id', 'date_account_created', 'timestamp_first_active', 'gender', 'age', 'country_destination'} as qualitative (nominal or ordinal or binary) or quantitative (discrete or continuous). Some cases may have more than one interpretation, briefly indicate your reasoning if you think there may be some ambiguity. (ii) List and briefly describe two other techniques for numerosity reduction.",BT3
"Use the contingency tables obtained in part (i) to compute and rank the rules in decreasing order according to the following measures: [A] Support; [B] Confidence; [C] Interest (X ? Y) = P( X, Y) / (P(X)*P(Y))",BT3
"[True/False] In comparison with the performance of a base classifier on a particular data set, bagging will generally not increase the error whereas as boosting may lead to an increase in the error.",BT3
"Given the contingency table, compute the following pairwise measures for clustering evaluation: (i) Jaccard coefficient (ii) Rand statistic (iii) Fowlkes–Mallows measure",BT2
"Solve the following HAC by considering the proximity matrix given, and consider inter-cluster similarity between clusters using: (i) Nearest neighbor linkage (ii) Farthest neighbor linkage And draw the corresponding dendograms",BT3
"Consider the following data set: Your task is to build a decision tree for classifying variable Y. (You can think of the data set as replicated many times, i.e. overfitting is not an issue here). (i) Compute the information gains IG(Y | V ), IG(Y | W) and IG(Y | X). Which attribute would Decision Tree classifier select first? (ii) Write down the entire decision tree constructed by Decision Tree classifier, without pruning. (iii) One idea for pruning would be to start at the root, and prune splits for which the information gain (or some other criterion) is less than some small ?. ",BT3
