Questions,Category
Design the circuit elements as shown in below figure to establish a DC drain current of 0.5mA. The NMOS is specified to have Vt=1V and kn’(W/L)=1mA/V2 and ?=0. Calculate the percentage change in the value of ID obtained when the MOSFET is replaced with another MOSFET having same kn’(W/L) but Vt=1.5V,BT3
Do you believe that you can become good teacher,BT6
"Draw the DC equivalent, AC equivalent and small signal equivalent model for common gate amplifier and derive the expressions for input, output impedance and voltage gain.",BT3
Derive an expression for drain current ID for NMOS in different regions of operation.,BT3
"Consider common source amplifier with constant current source biasing technique where VDD= -VSS =15V, current I=0.5mA, RG=4.7M?, RD=10K?, Vt=1.5V and Kn’(W/L)=1mA/V2 . Determine the Q-points and all the amplifier parameters assuming VA=75V.",BT3
"Using two transistors Q1 and Q2 having equal lengths but different widths related by W2/W1 = 5. Design a circuit that replicates current and obtain I=0.5mA. Let VDD=5V, kn’(W/L)1= 0.8mA/V2 , Vt=1V and ?=0. Find the required value of R? What is voltage at the gates of Q1 and Q2? What is the lowest voltage allowed at the drain of Q2 while Q2 remains in the saturation region?",BT3
How would you feel if you lost a big match,BT6
How would your life be different if you could breathe under water,BT5
Explain the working of N-channel enhancement mode MOSFET with relevant diagrams.,BT2
"The NMOS transistors used in the following circuits have Vt=1V, ?nCox= 120 µA/V2 , ?=0, L1=L2=L3=1?m. Find the equivalent values of gate widths for each of transistors to obtain voltage values as indicated in the figure and current of 120µA.",BT3
"A drain current of 115µA and drain voltage of 3.5V is to be developed across the MOSFET shown in below figure, obtain the value of R to meet the requirement. Given Vt= -0.7V, VDD=5V µpCox=60µA/V2 , L=0.8µm and ?=0. Determine the width of the channel.",BT3
"An amplifier with negative feedback has a voltage gain of 120. It is found that without feedback, an input signal of 60mV is required to produce a particular output. Find the Av and ? of the amplifier.",BT2
Discuss the general characteristics of a negative feedback amplifier.,BT2
Construct a tower one foot tall using only four blocks,BT5
"Derive an expression for input and output resistance of a voltage shunt feedback amplifier, and explain.",BT3
Explain the classification of power amplifiers based on the location of the operating point with neat diagrams.,BT2
"A class B power amplifier is delivering an output voltage of 10 volts peak to an 8 ? load, if the DC power supply is 30 volts; calculate i) DC power input. ii) AC power delivered to the load iii) Conversion efficiency iv) Power dissipated in the collector of each transistor.",BT3
"A loud speaker with an 8 ohm input resistance requiring a power of 0.5 W is to be driven by the following amplifier configuration. VCC is a 9V battery, and the identical transistors have VCEsat = 0.5 V and IBEO=0. Select a suitable turn’s ratio for output transformer.",BT3
"The vehicle is to be started on a cold winter morning, and then has to navigate hilly terrains. How does the engine cope-up with the different requirements as the vehicle goes from start to cruising? Suggest a design strategy using different control modes with appropriate details.",BT3
Put these words together to form a complete sentence,BT5
"What is Stoichiometric ratio? i) Calculate Lambda if air fuel ratio is 13.2. ii) Determine the fuel injector pulse duration (base pulse width Tw) and fuel quantity for the eight cylinder fully warmed up and very cold engine running at 4000 rpm, having a fuel flow rate of 0.0022Kg/sec and mass air flow rate of 0.0035Kg/sec.",BT3
"For the development of an Engine ECU, apply MBD approach adhering to automotive V design model.",BT3
"With MAF sensor malfunctioning as detected by the engine control system diagnostic function, how engine control system can work effectively as possible with other existing sensor information for calculating the mass air flow rate",BT3
What do you think about your work so far,BT6
Assume a vehicle is running at a fixed rpm of 8000 and further the driver demands for increase in speed. How the engine ECU handles driver’s request using ignition timing? Suggest a suitable Instrumentation system with related electronics for closed loop control of ignition timing.,BT3
"Vehicle is moving with a high speed; suddenly the driver applies the brakes, what is the physical consequence of this condition on wet and dry surface? Provide a suitable control system/electronic solution to avoid the damage",BT3
"What do you mean by Engine Mapping? For the engine operating in closed loop mode how the variations in, i) Exhaust gas recirculation ii) Air fuel ratio and iii) Ignition timing affect its performance. Show with the necessary plots",BT2
laborate on different segments of automotive industry and also discuss about automotive supply and value chain.,BT2
"Vehicle is moving on an icy surface with the engine rpm of 4000, but the vehicle is unable to move forward, what is the physical consequence of this condition? Provide a control system solution to overcome this problem",BT2
"Describe the control system which provides a solution for wheel spinning, and discuss the related control functions. Brief on operating sequence of drivers air bag.",BT2
"Compare event driven and time triggered communication strategies. Calculate nominal and maximum THeader ,TResponse and TFrame, if LIN is operating at 10Kbps baud rate and reserved time is set to 30% for transmitting two bytes of data.",BT3
What is ride and handling of an automobile? How electronic suspension system manages the compromise between ride comfort and handling.,BT2
"Discuss the physical mechanism of wheel lock and vehicle skid that can occur during braking; How the ABS configuration provides a solution for this. If the vehicle longitudinal acceleration is zero, i) Calculate the wheel slip if vehicle speed is matching with wheel speed? ii) Calculate wheel slip for Fl(Front left) and Fr(Front right), when vehicle speed is 70kph and WssFl(Wheel speed front left) and WssFr(Wheel speed front right) are reading 67kph and 69kph respectively iii) Calculate wheel slip when panic braking is done at 150kph and ABS is shut down due to pump failure?",BT3
How to improve the efficiency/performance/reliability of engine control unit by adding any extra sensors for the existing system? Mention the significance of sensors & related variables to be measured for engine control system.,BT3
"Assume that the driver has activated the cruise control switch set for the desired speed of (say, 60 mph). For the following conditions determine the action of throttle , controlled by the suitable control algorithm ; i) If the car is travelling on a level road ii) If the car were then to enter a long hill with a steady positive slope (i.e., a hill going up). Optimize the system for following performance parameters, 1. Quick response 2. Relative stability 3. Small steady-state error 4. Optimization of the control effort required",BT3
"Answer the following with respect to CAN communication i) The CAN node receives the message as 1011110, state whether the received information is error free or not. Assume CRC with a generator polynomial as 1011. ii) How small nodes can be kept from overloading with received messages iii) Message prioritization in case of CAN protocol. iv) Draw the message sequence seen by the CAN bus for the given scenario.",BT2
Explain the construction and working principle of magnetic reluctance angular position sensor. What is the drawback of this sensor and how it is overcome? Discuss the operation of fuel injector.,BT2
"The fast moving car is turning at the corner, if the vehicle is turning less/more than the driver’s intention suggest a suitable control system along with the break circuit configuration to overcome this condition.",BT3
For an electric vehicle propulsion system the hazardous event is described as “Un intended vehicle acceleration during a low speed maneuver amongst pedestrians”. Perform suitable hazard analysis and risk assessment for this case,BT2
An engine going through cold cranking the air/fuel ratio is not able to be controlled. Analyze the possible faults.,BT3
"The CAN node has to transmit the speed sensor information from engine ECU to ESP ECU. The size of the information of 5 bits, show how this message is transmitted, and discusses how the CAN receiver node determines whether the message is error free or not.",BT3
A 2015 Audi A8 was having a problem with rough running which in turn was causing the engine management light to illuminate. Analyze the possible faults,BT3
Analyze the impact of Semi-custom and Full-custom VLSI design styles based on design cycle time and the achievable circuit performance.,BT2
"What are the limitations of planar VLSI technology, and discuss the advantages and challenges in 3D devices like FinFET devices.",BT2
"In VLSI fabrication, oxides in varying thickness and compositions are used for different processes. Discuss each of them with relevant examples.",BT2
"Discuss the capacitance modeling of an nMOS device during cutoff, linear and saturation.",BT2
"Design an AOI221 gate using fully CMOS logic, so as to achieve same transient performance as that of a reference CMOS Inverter.",BT3
"Solve the node voltages in the arrangements given below if Vtn = 0.6V and Vtp = -0.6V. What may happen to the output voltage, if the back-gate effect is also considered?",BT3
An inverter needs to be fabricated using planar CMOS technology in a twin-tub process. Illustrate the fabrication steps with cross-sectional views and appropriate masks used at each stage.,BT3
"A circuit designer has a choice to implement combinational logic using NAND or a NOR network. Justify the selection if performance is the criteria, and analyze the speed of a 1 to 0 transition as shown below. The output cap has a value of Cout=130fF, while the internal values are C1=C2=36fF. The transistors are identical with ?n=2.0mA/V2 in a process where VDD=3.3V & VTn=0.7V. i. Find the discharge time constant for Cout=130fF using the ladder RC network. ii. Find the time constant if we ignore C1 & C2. iii. What is the percentage error introduced if we do not include the internal capacitors?",BT3
Discuss the phenomenon of latch-up and illustrate ways of dealing with it in CMOS VLSI design.,BT2
What is the need to study ?-based design rules? How are they different from micron rules? Illustrate ?-based design rules with an example layout,BT3
Identify the circuit from the layout given below. Is it a valid layout? If yes then what is the type of logic style it represents?,BT3
Discuss the charge sharing issue in Dynamic CMOS logic. What will happen if we directly cascade two stages of this gate? Propose a remedy for the cascading problem,BT3
"In the figure, find the output in terms of inputs A, B and C when the clock CK is high. Also implement the clocked CMOS equivalent of the same.",BT3
Consider the logic cascade shown in figure below .Use logical effort to find the relative size of each stage needed to minimize delay through the chain. Assume symmetric gates with r = 2.5.,BT3
"For the given logical expression for ?? = ?????( ??????+???????) ??+?????????? design a suitable logic circuit using CMOS with stick-diagram layout, and optimize the ordering of poly gates in the layout by using appropriate method.",BT3
Consider the logic chain of a co-processor shown below. The input at A is switched from a 1 to 0. Find an expression for the delay time through the chain using an appropriate procedure.,BT3
Illustrate the flip-flop min-delay constraint with appropriate waveforms and equations.,BT3
What story did you like the best,BT6
Explain the working of a standard CMOS flip-flop using TGs.,BT2
Do you think that the pioneers did the right thing,BT6
A simple latch can be implemented using one MOS device. Discuss the variations and design improvements that can be made based on logic requirements.,BT3
Write a short note on Global clock-generation and distribution,BT2
"Rewrite the following Boolean expression in the minterm and maxterm canonical forms. P=F(x,y,z) =x’(y’+z)+z’",BT2
Why do you think Benjamin Franklin is so famous,BT6
Explain the working of ECL OR gate with the help of neat circuit diagram.,BT3
"On a certain weekend Ramu, Raheem and Johnny planned to have lunch in a restaurant and/or watch a movie. i) When all friends agree, they will have lunch after watching a movie. ii) No question of going out when none of them agree. iii) If Ramu agrees, then irrespective of others opinion, they only have lunch together. iv) If Ramu disagrees, they will only watch a movie. Design a suitable digital system by using a positive logic, for the above conditions with a non programmable technique in SOP and POS formats.",BT3
Can you develop a proposal which would,BT5
"Realize the following Boolean function with multiplexer F(A,B,C,D) = m(0,1,3,4,8,9,15) i) Using 16:1 MUX ii) Using 8:1 MUX with A,B,C select lines iii) Using 4:1 MUX with A,B select lines",BT3
"Identify a technique that cannot be programmed and that is used for less number of variables, to provide minimal sums and minimal products for the following Boolean function. f(w,x,y,z)= ?m( 1,5,8,14) + X( 4,6,9,11,15)",BT3
Can you write a new recipe for a tasty dish,BT5
Design a digital system to add two Binary Coded Decimal numbers using binary adder.,BT3
Explain the operation of a SR latch,BT2
Can you create new and unusual uses for,BT5
Design a 4-bit Johnson counter using the principle of Universal Shift Register (USR),BT3
"The figure shows a binary up counter with synchronous clear input. With the decoding logic shown, the counter works as a Mod-n counter. Find the value of n.",BT3
What is race around condition? Explain the remedy for the same problem in case of JK F/F.,BT2
How many ways can you,BT5
Return statement can only be used to return a single value. Can multiple values be returned from a function? Justify your answer,BT4
Bob wrote a program using functions to find sum of two numbers whereas Alex wrote the statements to find the sum of two numbers in the main() function only. Which of the two methods is efficient in execution and why,BT4
What would happen if,BT5
Carly wants to store the details of students studying in 1st year and later on wishes to retrieve the Examination Reform Policy 39 information about the students who score the highest marks in each subject. Specify the scenario where the data can be organized as a single 2-D array or as multiple 1-D arrays.,BT4
"Design a digital system using minimum number of data flip flops to monitor the number of buses available in the bus depot on daily basis for the following conditions, over a week. • On Sunday the occupancy of bus depot is 15 buses. • On Monday 2 buses were sent for service. • On Tuesday 3 buses went for college trip. • On Wednesday 1 bus returned from service. • Next day 5 more buses left for marriage party. • On Friday buses returned from college trip. • On Saturday 2 buses were sent for service",BT3
Five JK flip-flops are cascaded to form the circuit shown in figure. Clock pulses at a frequency of 1MHz are applied as shown. Compute the frequency (in KHz) of the wave,BT3
Analyze a negative edge triggered D Flip-Flop with the help of timing diagram.,BT3
Design a digital system using suitable logic to count from (0010)2 till it reaches (1101)2 continuously. The external clock is given to the first Flip-Flop and triggers it during rising edge of the pulse. The successive Flip-Flops are to be triggered by its predecessors.,BT3
A three bit pseudo random generator is as shown. Initially the value of output Y=Y2Y1Y0 is set to 111. Evaluate the value of output Y after three clock cycles.,BT3
to deal with,BT5
"Draw Mealy and Moore synchronous machine models and label the excitation variables, state variables, input and output variables.",BT2
Design a digital controller for the state table given below using a sequential component with single input.,BT3
"Differentiate between SRAM, DRAM, NVRAM",BT2
Why don't you devise your own way,BT5
Explain the read and write operations of SRAM.,BT2
Derive the expression for output impedance of Wilson current mirror with relevant circuit diagram and equivalent circuits.,BT3
"For the non inverting amplifier R1=470? and RF=4.7K ?, A=200000, Ri=2M ?, Ro=75 Fo=5Hz, supply voltage is +/-15V and output voltage swing is +/-13V .Calculate the values of AF, Rif. Rof ,Ff and VOOT",BT2
Dave is working on a Campus Management Software but is unable to identify the maximum number of students per course. He decided to implement the same using arrays but discovered that there is memory wastage due to over-provisioning. Which method of memory storage should be used by Dave and how it can be implemented using C,BT4
If you had access to all resources how would you deal with.,BT5
Albert is working on a 32-bit machine whereas Julie is working on a 64-bit machine. Both wrote the same code to find factorial of a number but Albert is unable to find factorial of a number till 9 whereas Julie is able to find the factorial of higher number. Identify the possible reason why Albert is unable to find the factorial. Suggest some changes in the code so that Albert can handle bigger inputs.,BT4
"Consider the circuit shown below, assuming (W/L)1-3=40/0.5,Iref=0.3mA a. Determine Vb such that Vx=Vy b. If Vb deviates from the value calculated in part (a) by 100mV, what is the mismatch between Iout and Iref?",BT3
Derive an output voltage expression for 5-pack differential amplifier with neat circuit diagram with relevant Explanation.,BT3
"Discuss the effect of negative feedback on non-idealities of the Op-amp, with neat diagram and relevant equations.",BT2
"Identify the circuit shown below where all transistors have Vt=0,6V, ?nCox=160 W1=W4=4?m, and W2=W3=40?m. L=1?m and IREF is 20?A. Determine the output current and the voltages at the gates of Q2 and Q3. What is the lowest voltage at the output for which current source operation is possible? What are the values of gm and ro of Q2 and Q3? What is the output resistance of the circuit?",BT3
"Identify the amplifier configuration given below, with (W/L)1,2=25/0.5, µnCox=50µA/V2 , VTH=0.6V, ?=?=0 and VDD =3V a. What is the required input CM for which RSS sustains 0.5V? b. Calculate RD for a differential gain of 5",BT3
List the ideal characteristics of an OPAMP. Give its symbolical representation and explain the functions of each terminal. Tabulate the ideal op-amp terminal characteristics.,BT2
"For the differential amplifier with the current mirror as a load ,determine the (W/L) and drain current of all MOSFET’s for the following specifications: Vdd=-Vss=2.5V,SR>=10V/us (Cload=5pf),f-3db>= 100kHz (CL=5pF),a small signal voltage gain of 100,-1.5<=ICMR<=2V and Pdiss<=1mW. Model parameters: KN’= 110uA/V2, KP’= 50uA/V2, VTP=-0.7V, VTN=0.7V, ?N=0.04V1,?P= 0.05V-1 .",BT3
Derive the expression for the output current Io in terms of input voltage Vin for a grounded load using Op-amp.,BT2
Describe the inverting differentiator and obtain the expression for the output voltage with neat circuit diagram and waveforms,BT3
Identify the following circuit operation. Find,BT3
Derive the expression for summing and averaging amplifier output for • Non-inverting amplifier • Differential amplifier Using Op-amp with neat circuit diagram.,BT3
"Two different pre-amp microphones are used in a recording studio, one for vocals and other for the musical instrument with output voltage in the range of 0-2V and 0-0.5V respectively. Design a suitable circuit using Op-Amp to combine signals from both the microphones in such a way that the signal corresponding to the musical instrument should be twice amplified as that of vocal signal.",BT3
"i. Find VN,VP and Vo in the circuit if Vs=9V ii. Find the resistance R that, if connected between the inverting input pin of the op-amp and ground which causes Vo to double.",BT3
Obtain the output expression using a suitable circuit to get the following waveform Z (t) at the output side. Explain with the help of frequency response.,BT2
"It is required to measure the weight of the vehicle using weigh bridge system, arrive at a suitable signal conditioning circuit for measuring the weight in terms of voltage. Using circuit analysis techniques arrive at an expression for the output voltage in terms of input weight.",BT3
"Obtain a suitable circuit for the following frequency response with AF=10, fH and also derive the expression for the gain AF and cut off frequency fH",BT3
Design a circuit using Op-Amp to obtain the following transfer characteristics. Explain the operation using waveforms and obtain the expressions. VLTP=-2; VUTP=3; VSAT=15; –VSAT=15.,BT3
"Draw the circuit configuration to generate triangular wave, describe the circuit operation using waveforms.",BT2
Implement a monostable multivibrator using the timer circuit shown in below figure. Also determine an expression for ON time ‘T’ of the output pulse.,BT3
Explain the precision peak detector and precision clamping circuit with neat diagrams.,BT2
"Calculate the average wait time & TAT for following processes using • SJF (pre-emptive & non-pre-emptive), • Priority scheduling • RR Compare their performance.",BT3
"Apply suitable code optimization techniques for the following C statements. ii. Determine the longest path through each code fragment, assuming that all statements can be executed in equal time and that all branch directions are equally probable",BT3
"Suppose computer system hardware is to be operated without an OS, discuss the scenario of using this computer for running an application in which password authentication is to be made. Discuss disadvantages of a computer without an OS. Elaborate on the role of OS and its functions.",BT2
"Under what circumstances is rate-monotonic scheduling inferior to earliestdeadline-first scheduling in meeting the deadlines associated with processes? Consider the following activities of a car control system. 1. C= worst case execution time 2. T= (sampling) period 3. D= deadline Speed measurement: C=4ms, T=20ms, D=20ms ABS control: C=10ms,T=40ms, D=40ms Fuel injection: C=40ms,T=80ms, D=80ms Try any of the two methods to schedule the tasks.",BT3
"In a multiprogramming and time sharing environment, several users share the system simultaneously. Discuss the security problems that may arise in the situation. Assess the degree of security that can be achieved in both the cases.",BT2
solve that Icq =/ Can Icq be made independent of B how,BT1
"Design a logic circuit to display 1,2,4 and 9 only from BCD to six segment display shown in fig.",BT4
Implement function F given in table using 8:1 Multiplexer,BT4
It is required to generate a student’s register enrolled for engineering course in alphabetical order to distribute student's ID. Develop a code using i. Inline assembly ii. Mixed assembly comment on the performance w.r.t time and memory using appropriate optimization technique,BT3
"Convert the algorithm given in flowchart into 1) “Normal” assembler, where only branches can be conditional. 2) ARM assembler, where all instructions are conditional. 3) Develop 'C' code with optimization 4) Comment on performance w.r.t 1, 2 and 3",BT3
Construct a simple “for loop” in C which operates on an array element in each iteration. Then rewrite the code using suitable loop optimization techniques. Comment on the performance.,BT3
An Operating system’s PID manager is responsible for managing process identifiers. A unique ID is assigned to the process when it is first created. Discuss how this PID is managed using PCB. Elaborate on process and PCB.,BT2
"Write a code for the scenario where an application needs to perform division operation and display the result on a serial port i. Whenever the divisor is found to be zero, message to be displayed is “division error” ii. Whenever the divisor is smaller than zero, message to be displayed is “underflow error”.",BT3
Can you see a possible solution to,BT5
Why not compose a song about,BT5
An automotive company claims that the active suspension components in its newest vehicles analyze and respond to road conditions for every 2.5 cm at 100 kilometers per hour (1 inch of highway travel at 60 mph). Develop a prototype C code by applying RTOS concepts to realize the above scenario,BT3
Write an application to measure the time taken to execute the “for loop” i) With “loop unrolling” ii) Without “loop unrolling” Both loops are part of two different tasks. Display the time using serial port.,BT3
"Write an optimized code to create two applications: i. “App1” to convert analog to digital data and store the result in memory pool, ii. “App2” to use this information and display on serial port. Demonstrate optimization with code profiling.",BT3
What are the different means of achieving multitasking? Explain with suitable examples.,BT2
"Develop a prototype C code by applying RTOS concepts to realize the simple vending machine. The vending machine will sell bottles for $75. Customers can enter either a dollar or quarters. Once sufficient amount of money is entered, the vending machine will dispense a bottle of water. If user enters a dollar it will return one quarter in change. A Money Receiver detects the total money entered. The bottle dispenser system holds the water bottles and releases one bottle when the input signal is asserted. A coin return system holds quarters for change and will release one quarter when input is dollar. The money receiver will reject money if a dollar and quarter are entered simultaneously.",BT3
